,ticker,date,time,title,compound
0,BABA,2022-05-06,06:15PM  ,5 Best Chinese Stocks To Buy And Watch,0.6369
1,BABA,2022-05-06,02:57PM  ,"Google Jumps The Crypto Bandwagon To Win Cloud Market From Alibaba, Amazon, Microsoft",0.6705
2,BABA,2022-05-05,03:45PM  ,"Tesla, Amazon, Alibaba among biggest market laggards of the day",0.1779
3,BABA,2022-05-05,03:00PM  ,"7 Stocks Reporting Earnings the Week of May 9, 2022",0.0
4,BABA,2022-05-05,12:40PM  ,"April Jobs, Cigna Earnings, Alibaba Reports: 3 Things to Watch",0.0
5,BABA,2022-05-04,10:20AM  ,Didi Leads Slump in U.S.-Listed Chinese Shares Amid SEC Probe,0.296
6,BABA,2022-05-04,10:16AM  ,DiDi Stock Plunges. An SEC Probe Has Alibaba and JD.com Investors On Edge.,0.0
7,BABA,2022-05-04,09:55AM  ,Why Alibaba Fell 10.8% in April,0.0
8,BABA,2022-05-04,08:26AM  ,Is Now the Right Time to Sell Your Alibaba (BABA) Stake?,0.0
9,BABA,2022-05-04,08:14AM  ,Jack Ma 'Arrest' and SEC's DiDi Investigation Whack China Tech Stocks,0.0
10,BABA,2022-05-04,06:52AM  ,DiDi Stock Plunges. An SEC Probe Has Alibaba and JD.com Investors On Edge Too.,0.0
11,BABA,2022-05-04,04:41AM  ,Didi Global Says It Faces SEC Probe Related to U.S. IPO,0.0
12,BABA,2022-05-04,12:00AM  ,Alibaba targets bargain-hunting shoppers to boost slowing sales growth,0.6486
13,BABA,2022-05-03,05:45PM  ,Alibaba (BABA) Stock Sinks As Market Gains: What You Should Know,0.34
14,BABA,2022-05-03,11:32AM  ,Alibaba stock falls over Jack Ma mistaken arrest rumor,-0.5994
15,BABA,2022-05-03,10:46AM  ,"Amazon workers reject union, Georgia entices Rivian to build plant, Jack Ma rumor causes Alibaba stock crash",-0.5719
16,BABA,2022-05-03,09:11AM  ,"Alibaba Stock Tumbled, Then Rebounded, on Ma Confusion. What to Know.",-0.296
17,BABA,2022-05-03,09:03AM  ,15 Most Valuable Platform Companies in the World,0.5256
18,BABA,2022-05-03,08:48AM  ,Alibaba Stock Drops After Report of Ma Arrest. It Wasnt Billionaire Founder Jack.,-0.34
19,BABA,2022-05-03,05:10AM  ,Alibaba Stock Drops After Report of Ma Arrest. It Wasnt Billionaire Founder Jack.,-0.34
20,BABA,2022-05-03,04:52AM  ,China Tech Stocks Fall as Policy Jitters Outweigh Support Vows,0.4019
21,BABA,2022-05-03,01:30AM  ,Chinese state media report on Ma detention sparks Alibaba sell-off,-0.3612
22,BABA,2022-05-03,01:26AM  ,Alibaba Recovers After Report on Ma Briefly Erased $26 Billion,0.0
23,BABA,2022-05-02,11:59PM  ,"Alibaba stock falls, then recovers, after state media report",0.0
24,BABA,2022-05-02,09:37PM  ,"Alibaba Shares Drop, Then Recover Losses, Over News Report",-0.3818
25,BABA,2022-05-02,08:53PM  ,Musks Grand Vision for Twitter Faces Reality Check in Asia,0.6124
26,BABA,2022-05-02,05:46PM  ,Top 10 Stocks to Buy Today According to Kerr Neilsons Platinum Asset Management,0.5106
27,BABA,2022-05-02,12:51PM  ,"Mizuho Continues To See Upside In Alibaba, JD, Baidu, Dada Amid Odds",0.0
28,BABA,2022-05-02,08:43AM  ,Should Weakness in Alibaba Group Holding Limited's (NYSE:BABA) Stock Be Seen As A Sign That Market Will Correct The Share Price Given Decent Financials?,-0.1531
29,BABA,2022-05-01,09:24PM  ,India Accuses Xiaomi of Forex Violations in Latest China Clash,-0.7003
30,BABA,2022-04-29,04:49PM  ,Alibaba Lead Gains in U.S. listed China Stocks on Beijing Vow,0.34
31,BABA,2022-04-29,03:51PM  ,"Alibaba leads China stocks higher, Walmart unveils activewear line, Amazon stock plunges",0.1779
32,BABA,2022-04-29,02:43PM  ,"Alibaba, China Stocks Rise; Government Said to Mull Easing Regulations",0.25
33,BABA,2022-04-29,12:55PM  ,"Alibaba Stock Surges As Crackdown Fears Ease, But Is BABA Stock A Buy Now?",-0.0387
34,BABA,2022-04-29,11:20AM  ,"Why DiDi Global, JD.com, and Alibaba Are Up Today",0.0
35,BABA,2022-04-29,07:42AM  ,"Alibaba, other China ADRs soar after WSJ report China to pause putting pressure on tech giants",-0.296
36,BABA,2022-04-28,09:12PM  ,"Alibaba, Baidu Estimates Slashed on Covid Lockdowns",-0.2263
37,BABA,2022-04-28,07:10PM  ,3 Chinese Stocks on Red Alert Amid Shanghai Shutdowns,0.296
38,BABA,2022-04-28,03:27PM  ,"Analyst Slash Earnings Estimates For Alibaba, Baidu, Others Again Amid Surging Covid Environment",-0.2732
39,BABA,2022-04-28,12:02PM  ,Heres When to Make Your Move With Weakened Alibaba Stock,-0.3182
40,BABA,2022-04-28,03:16AM  ,Alibaba looks to expand Southeast Asian arm Lazada to Europe - sources,0.3182
41,BABA,2022-04-28,03:03AM  ,Alibaba looks to expand Southeast Asian arm Lazada to Europe - sources,0.3182
42,BABA,2022-04-27,11:59AM  ,"Why Alibaba, JD.Com, and Zhihu Are Rising Today",0.0
43,BABA,2022-04-27,07:14AM  ,Better E-Commerce Stock: Alibaba or MercadoLibre?,0.4404
44,BABA,2022-04-27,05:30AM  ,"NetEase CEO William Ding relinquishes corporate roles at subsidiary, as China's internet chieftains scale back their duties",0.0
45,BABA,2022-04-26,02:25PM  ,Stay Away From Alibaba Until Headwinds Clear Up,0.3818
46,BABA,2022-04-26,10:05AM  ,Market check: Stocks fall ahead of Big Tech earnings,0.0
47,BABA,2022-04-26,08:53AM  ,Alibaba Stock Rises After China Signals Economic Support. It Might Not Matter.,0.3871
48,BABA,2022-04-25,09:53PM  ,Jeff Bezos Takes Aim at Musks Twitter Deal With China Jibe,0.0
49,BABA,2022-04-25,05:45PM  ,Alibaba (BABA) Stock Sinks As Market Gains: What You Should Know,0.34
50,BABA,2022-04-25,05:25PM  ,Chinese Stocks in the U.S. Whipsaw Amid Growing Lockdown Woes,-0.296
51,BABA,2022-04-25,10:42AM  ,"Big Tech earnings will be a mixed bag, analyst says",0.0
52,BABA,2022-04-25,09:28AM  ,COVID-19 wave in China prompts sell-off in global markets,0.0
53,BABA,2022-04-25,09:00AM  ,Here is What to Know Beyond Why Alibaba Group Holding Limited (BABA) is a Trending Stock,-0.2263
54,BABA,2022-04-25,08:29AM  ,Alibaba Stock Drops to Its Lowest Level in 6 Years. Whats Behind the Latest Fall.,-0.3818
55,BABA,2022-04-25,08:08AM  ,ByteDance Hires Skadden Lawyer as CFO While IPO Remains in Limbo,0.0
56,BABA,2022-04-23,08:00PM  ,Contrarian Who Called China Tech Selloff Says Its Not Over Yet,0.0
57,BABA,2022-04-22,02:56PM  ,Why Alibaba Was Rising Today on a Terrible Day for the Markets,-0.4767
58,BABA,2022-04-22,01:17PM  ,Alibaba Group Earth Day Roundup: Alibaba To Share Green Patents; Lazada Says No to Plastic! Ele.me Rolls Out Low-Carbon Points Program,0.0
59,BABA,2022-04-22,10:17AM  ,"Market check: Stocks fall, China stocks sell-off as central banks tighten",0.0
60,BABA,2022-04-22,05:30AM  ,"Chinese social e-commerce firm Xiaohongshu trims 9 per cent of staff, joining Alibaba, Tencent, others in lay-off wave",0.0
61,BABA,2022-04-22,05:30AM  ,"Alibaba joins Meta, Microsoft to share low-carbon technology patents on Earth Day",0.296
62,BABA,2022-04-21,08:24PM  ,Alibaba Group Joins Low Carbon Patent Pledge to Accelerate the Adoption of Green Technology,-0.2732
63,BABA,2022-04-21,08:07PM  ,Alibaba Group Joins Low Carbon Patent Pledge to Accelerate the Adoption of Green Technology,-0.2732
64,BABA,2022-04-21,10:12AM  ,"Tesla stock surges, China stocks under pressure, travel stocks rally",-0.296
65,BABA,2022-04-21,01:38AM  ,"Data Rules Risk Making China Digital Island, Companies Say",-0.2732
66,BABA,2022-04-20,08:30PM  ,"JD, Alibaba Stock Exodus From New York Intensifies",0.0
67,BABA,2022-04-20,04:01PM  ,"Why We Need Green Artificial Intelligence, Alibaba's DAMO Academy Explains",0.4767
68,BABA,2022-04-20,09:48AM  ,"Warren Buffett Stocks: GOOGL, MSFT, FB Among 26 Stocks On This Screen",0.0
69,BABA,2022-04-19,06:51PM  ,"Alibaba: Near-Term Headwinds Wont Derail Long-Term Growth, Says Analyst",-0.0762
70,BABA,2022-04-19,05:45PM  ,Alibaba (BABA) Stock Sinks As Market Gains: What You Should Know,0.34
71,BABA,2022-04-19,11:10AM  ,"Market check: Stocks flat, 30-year Treasury yield hits 3%",0.2023
72,BABA,2022-04-19,09:33AM  ,"Alibaba, Bilibili, and China Tech Stocks Slide on Livestreaming Crackdown",0.0
73,BABA,2022-04-19,05:17AM  ,"Bilibili, Alibaba, and China Tech Stocks Slide on Livestreaming Crackdown",0.0
74,BABA,2022-04-18,11:14PM  ,Didis Brief U.S. Foray Is Ending. What Happens Next?,0.0
75,BABA,2022-04-18,09:52AM  ,"Market check: Stocks mixed at open, bitcoin sees 5-day drop",-0.2732
76,BABA,2022-04-18,05:30AM  ,"Ant Group to take over Singapore-based payments firm 2C2P as fintech giant sharpens focus on growth, overseas expansion",0.3818
77,BABA,2022-04-15,11:30AM  ,"Charlie Munger Dumped Alibaba, but Analysts Are Still Bullish",-0.2144
78,BABA,2022-04-15,09:27AM  ,Alibaba's Tmall Pilots Carbon Labeling to Drive Sustainable Consumption,0.0
79,BABA,2022-04-14,07:14PM  ,Alibaba Seems Attractive Following Sell-Off,0.4404
80,BABA,2022-04-14,02:44PM  ,Alibaba Tech VP Mocks China's Covid Policies; Clarifies Not Resigning,-0.1114
81,BABA,2022-04-14,08:09AM  ,Better E-Commerce Stock: Shopify vs. Alibaba,0.4404
82,BABA,2022-04-14,07:49AM  ,"Midday Stock Movers: Nike, Twitter Climb, Alibaba Slides",0.0
83,BABA,2022-04-14,05:30AM  ,Ukraine war: Shenzhen smartphone maker AGM's Russian business on thin ice after invasion,-0.5994
84,BABA,2022-04-13,10:03PM  ,Xis Graft-Buster Has Direct Role in Probe of Jack Mas Ant,0.0
85,BABA,2022-04-13,04:01PM  ,How Alibaba Cloud Data Centers Will Reach 100% Clean Energy By 2030,0.5994
86,BABA,2022-04-13,10:52AM  ,Alibaba Undergoes Aggressive Restructuring At Its Cloud Unit,-0.1531
87,BABA,2022-04-13,09:03AM  ,Banking Circle in Funding Talks at Half Initial Valuation Pitch,0.0
88,BABA,2022-04-13,05:30AM  ,"Alibaba Cloud undergoes leadership reshuffle, report says, joining China's tech industry upheaval",0.0
89,BABA,2022-04-12,04:12PM  ,"Stocks close at session lows, energy stocks among leading performers",0.0772
90,BABA,2022-04-12,03:22PM  ,Alibaba Alert: Charlie Munger Cuts BABA Stock Stake in Half. Should You?,0.0
91,BABA,2022-04-12,09:52AM  ,Is Trending Stock Alibaba Group Holding Limited (BABA) a Buy Now?,-0.2263
92,BABA,2022-04-12,09:46AM  ,Altron Capital on Alibaba (BABA): We See No Reason to Sell,-0.296
93,BABA,2022-04-12,05:30AM  ,Buffett's friend at Daily Journal halves Alibaba's stake as stock slump hits US$212 million portfolio,0.4939
94,BABA,2022-04-11,05:11PM  ,"Daily Journal, long overseen by Charlie Munger, halves stake in China's Alibaba",0.0
95,BABA,2022-04-11,04:33PM  ,Charlie Mungers Daily Journal Slashed Its Stake in Alibaba Stock,-0.2263
96,BABA,2022-04-11,02:47PM  ,Munger-Tied Daily Journal Slashes Its Alibaba Stake in Half,-0.2023
97,BABA,2022-04-11,02:16PM  ,China Tackles Towering Garbage Heaps With Artificial Intelligence,0.4767
98,BABA,2022-04-11,09:46AM  ,Alibaba's Jack Ma Severes Ties With Co-founded Lifestyle Firm,0.0
99,BABA,2022-04-11,09:34AM  ,"China stocks drop, EV maker Nio to halt production amid COVID outbreak",-0.2732
